{
  "schemaVersion": "labcentral.proxmox-qualification-probe-request/v1",
  "runID": "qualification.probe-001",
  "nonce": "aaaaaaaaaaaaaaaaaaaaaaaaaaaaaaaaaaaaaaaaaaaaaaaaaaaaaaaaaaaaaaaa",
  "attempts": 3,
  "timeoutMillis": 500,
  "targets": [
    {"kind": "intended_segment", "address": "10.220.0.11:9443"},
    {"kind": "management", "address": "10.0.0.2:8006"},
    {"kind": "cross_instance", "address": "10.221.0.10:9443"}
  ]
}
